<?xml version="1.0" encoding="UTF-8" standalone="no" ?>
<profiles model-version="4.8.2" xmlns:xsi="http://www.w3.org/2001/XMLSchema-instance" xsi:noNamespaceSchemaLocation="schemas/4.3.3/exercise/profiles.xsd">
  <profile name="Preparator" password="" supervision="true">
    <rights>
      <readonly/>
      <readwrite>
        <side id="3"/>
        <side id="1"/>
      </readwrite>
    </rights>
  </profile>
  <profile name="Automate RENS RADINT Renseigner Sur" password="" supervision="true">
    <rights>
      <readonly/>
      <readwrite>
        <side id="3"/>
        <side id="1"/>
      </readwrite>
    </rights>
  </profile>
  <profile name="Automate RENS ROEM Elge Appuyer" password="" supervision="true">
    <rights>
      <readonly/>
      <readwrite>
        <side id="3"/>
        <side id="1"/>
      </readwrite>
    </rights>
  </profile>
  <profile name="Automate RENS ROEM Brovab Appuyer" password="" supervision="true">
    <rights>
      <readonly/>
      <readwrite>
        <side id="3"/>
        <side id="1"/>
      </readwrite>
    </rights>
  </profile>
  <profile name="Automate RENS ROEM Renseigner Sur" password="" supervision="true">
    <rights>
      <readonly/>
      <readwrite>
        <side id="3"/>
        <side id="1"/>
      </readwrite>
    </rights>
  </profile>
  <profile name="Automate RENS ROHUM Renseigner Sur" password="" supervision="true">
    <rights>
      <readonly/>
      <readwrite>
        <side id="3"/>
        <side id="1"/>
      </readwrite>
    </rights>
  </profile>
  <profile name="Automate RENS ROHUM SExfiltrer" password="" supervision="true">
    <rights>
      <readonly/>
      <readwrite>
        <side id="3"/>
        <side id="1"/>
      </readwrite>
    </rights>
  </profile>
  <profile name="Automate RENS ROIM CL289 Renseigner Sur" password="" supervision="true">
    <rights>
      <readonly/>
      <readwrite>
        <side id="3"/>
        <side id="1"/>
      </readwrite>
    </rights>
  </profile>
  <profile name="Automate RENS ROIM SDTI Renseigner Sur" password="" supervision="true">
    <rights>
      <readonly/>
      <readwrite>
        <side id="3"/>
        <side id="1"/>
      </readwrite>
    </rights>
  </profile>
  <profile name="Automate TRANS Commander" password="" supervision="true">
    <rights>
      <readonly/>
      <readwrite>
        <side id="3"/>
        <side id="1"/>
      </readwrite>
    </rights>
  </profile>
  <profile name="Automate GEN Degager Obstacles Dans Zone" password="" supervision="true">
    <rights>
      <readonly/>
      <readwrite>
        <side id="3"/>
        <side id="1"/>
      </readwrite>
    </rights>
  </profile>
  <profile name="Automate GEN Faire Franchir" password="" supervision="true">
    <rights>
      <readonly/>
      <readwrite>
        <side id="3"/>
        <side id="1"/>
      </readwrite>
    </rights>
  </profile>
  <profile name="Automate GEN Franchir De Vive Force" password="" supervision="true">
    <rights>
      <readonly/>
      <readwrite>
        <side id="3"/>
        <side id="1"/>
      </readwrite>
    </rights>
  </profile>
  <profile name="Automate GEN Ouvrir Itineraires" password="" supervision="true">
    <rights>
      <readonly/>
      <readwrite>
        <side id="3"/>
        <side id="1"/>
      </readwrite>
    </rights>
  </profile>
  <profile name="Automate GEN Realiser Travaux" password="" supervision="true">
    <rights>
      <readonly/>
      <readwrite>
        <side id="3"/>
        <side id="1"/>
      </readwrite>
    </rights>
  </profile>
  <profile name="Automate GEN Reconnaitre Zone" password="" supervision="true">
    <rights>
      <readonly/>
      <readwrite>
        <side id="3"/>
        <side id="1"/>
      </readwrite>
    </rights>
  </profile>
  <profile name="Automate GEN Retablir Itineraires" password="" supervision="true">
    <rights>
      <readonly/>
      <readwrite>
        <side id="3"/>
        <side id="1"/>
      </readwrite>
    </rights>
  </profile>
  <profile name="Automate GEN Se Deployer" password="" supervision="true">
    <rights>
      <readonly/>
      <readwrite>
        <side id="3"/>
        <side id="1"/>
      </readwrite>
    </rights>
  </profile>
  <profile name="Automate NBC Armer Un Site De Decontamination" password="" supervision="true">
    <rights>
      <readonly/>
      <readwrite>
        <side id="3"/>
        <side id="1"/>
      </readwrite>
    </rights>
  </profile>
  <profile name="Automate NBC Decontaminer Une Zone" password="" supervision="true">
    <rights>
      <readonly/>
      <readwrite>
        <side id="3"/>
        <side id="1"/>
      </readwrite>
    </rights>
  </profile>
  <profile name="Automate NBC Reconnaitre Un Axe" password="" supervision="true">
    <rights>
      <readonly/>
      <readwrite>
        <side id="3"/>
        <side id="1"/>
      </readwrite>
    </rights>
  </profile>
  <profile name="Automate NBC Reconnaitre Une Zone" password="" supervision="true">
    <rights>
      <readonly/>
      <readwrite>
        <side id="3"/>
        <side id="1"/>
      </readwrite>
    </rights>
  </profile>
  <profile name="Automate ASA Defendre Itineraire" password="" supervision="true">
    <rights>
      <readonly/>
      <readwrite>
        <side id="3"/>
        <side id="1"/>
      </readwrite>
    </rights>
  </profile>
  <profile name="Automate ASA ROLAND-CAROL Defendre Site" password="" supervision="true">
    <rights>
      <readonly/>
      <readwrite>
        <side id="3"/>
        <side id="1"/>
      </readwrite>
    </rights>
  </profile>
  <profile name="Automate ASA ROLAND-CAROL Defendre Zone" password="" supervision="true">
    <rights>
      <readonly/>
      <readwrite>
        <side id="3"/>
        <side id="1"/>
      </readwrite>
    </rights>
  </profile>
  <profile name="Automate ASA ROLAND-CAROL Surveiller" password="" supervision="true">
    <rights>
      <readonly/>
      <readwrite>
        <side id="3"/>
        <side id="1"/>
      </readwrite>
    </rights>
  </profile>
  <profile name="Automate ASA HAWK Defendre Site" password="" supervision="true">
    <rights>
      <readonly/>
      <readwrite>
        <side id="3"/>
        <side id="1"/>
      </readwrite>
    </rights>
  </profile>
  <profile name="Automate ASA HAWK Defendre Zone" password="" supervision="true">
    <rights>
      <readonly/>
      <readwrite>
        <side id="3"/>
        <side id="1"/>
      </readwrite>
    </rights>
  </profile>
  <profile name="Automate ASA HAWK Surveiller" password="" supervision="true">
    <rights>
      <readonly/>
      <readwrite>
        <side id="3"/>
        <side id="1"/>
      </readwrite>
    </rights>
  </profile>
  <profile name="Automate ASA MISTRAL Defendre Site" password="" supervision="true">
    <rights>
      <readonly/>
      <readwrite>
        <side id="3"/>
        <side id="1"/>
      </readwrite>
    </rights>
  </profile>
  <profile name="Automate ASA MISTRAL Defendre Zone" password="" supervision="true">
    <rights>
      <readonly/>
      <readwrite>
        <side id="3"/>
        <side id="1"/>
      </readwrite>
    </rights>
  </profile>
  <profile name="Automate ASA MISTRAL Surveiller" password="" supervision="true">
    <rights>
      <readonly/>
      <readwrite>
        <side id="3"/>
        <side id="1"/>
      </readwrite>
    </rights>
  </profile>
  <profile name="Automate ASS Acquerir Objectifs" password="" supervision="true">
    <rights>
      <readonly/>
      <readwrite>
        <side id="3"/>
        <side id="1"/>
      </readwrite>
    </rights>
  </profile>
  <profile name="Automate ASS Reconnaitre Zones Deploiement" password="" supervision="true">
    <rights>
      <readonly/>
      <readwrite>
        <side id="3"/>
        <side id="1"/>
      </readwrite>
    </rights>
  </profile>
  <profile name="Automate ASS Se Deployer" password="" supervision="true">
    <rights>
      <readonly/>
      <readwrite>
        <side id="3"/>
        <side id="1"/>
      </readwrite>
    </rights>
  </profile>
  <profile name="Automate ABC Appuyer" password="" supervision="true">
    <rights>
      <readonly/>
      <readwrite>
        <side id="3"/>
        <side id="1"/>
      </readwrite>
    </rights>
  </profile>
  <profile name="Automate ABC Appuyer sur position" password="" supervision="true">
    <rights>
      <readonly/>
      <readwrite>
        <side id="3"/>
        <side id="1"/>
      </readwrite>
    </rights>
  </profile>
  <profile name="Automate ABC Armer Point De Controle" password="" supervision="true">
    <rights>
      <readonly/>
      <readwrite>
        <side id="3"/>
        <side id="1"/>
      </readwrite>
    </rights>
  </profile>
  <profile name="Automate ABC Attaquer" password="" supervision="true">
    <rights>
      <readonly/>
      <readwrite>
        <side id="3"/>
        <side id="1"/>
      </readwrite>
    </rights>
  </profile>
  <profile name="Automate ABC Contre Attaquer" password="" supervision="true">
    <rights>
      <readonly/>
      <readwrite>
        <side id="3"/>
        <side id="1"/>
      </readwrite>
    </rights>
  </profile>
  <profile name="Automate ABC Controler" password="" supervision="true">
    <rights>
      <readonly/>
      <readwrite>
        <side id="3"/>
        <side id="1"/>
      </readwrite>
    </rights>
  </profile>
  <profile name="Automate ABC Couvrir" password="" supervision="true">
    <rights>
      <readonly/>
      <readwrite>
        <side id="3"/>
        <side id="1"/>
      </readwrite>
    </rights>
  </profile>
  <profile name="Automate ABC Donner Coup Arret" password="" supervision="true">
    <rights>
      <readonly/>
      <readwrite>
        <side id="3"/>
        <side id="1"/>
      </readwrite>
    </rights>
  </profile>
  <profile name="Automate ABC Eclairer" password="" supervision="true">
    <rights>
      <readonly/>
      <readwrite>
        <side id="3"/>
        <side id="1"/>
      </readwrite>